{
  "a2_receipt": {
    "candidate_snapshot_sha256": "6d0134bfc8d8c99b0efbe2c25947c25534b6e5513dbd51f859725c41ec466056",
    "handoff_id": "A1A2-TEST_FARRIER_001",
    "received_at": "2026-08-16T15:30:20Z",
    "receiver_id": "A2-SYNTHETIC-VALIDATOR",
    "receiver_profile": "equinet-a2-enrichment",
    "rejection_reasons": [],
    "status": "accepted"
  },
  "approval_event": {
    "decision": "approved_for_enrichment",
    "decision_at": "2026-08-16T15:30:00Z",
    "reviewer": {
      "actor_id": "UNITALK-A1-REVIEWER-TEST",
      "actor_role": "A1 Business Reviewer",
      "display_name": "Synthetic A1 Reviewer"
    },
    "scope": "a2_enrichment",
    "source_layer": "manual_review_package",
    "source_record_id": "REVIEW-TEST_FARRIER_001"
  },
  "candidate_snapshot": {
    "candidate_id": "A1-TEST_FARRIER_001",
    "confidence": {
      "level": "medium",
      "limitations": [
        "Only one synthetic source is present."
      ],
      "method_version": "proposed-confidence-0.1",
      "reasons": [
        "The synthetic source directly supports the core qualification claims."
      ],
      "score": 65
    },
    "data_governance": {
      "a1_outreach_prohibited": true,
      "collection_context": "public_business_information",
      "contains_personal_data": true,
      "retention_policy_version": null,
      "source_terms_review_status": "confirmed"
    },
    "data_quality": {
      "conflicts": [],
      "last_validated_at": "2026-08-11T10:10:00Z",
      "missing_fields": [],
      "validation_status": "validated"
    },
    "discovered_at": "2026-08-11T10:00:00Z",
    "duplicate_check": {
      "batch": {
        "checked_at": "2026-08-11T10:08:00Z",
        "matches": [],
        "method_version": "local-dedup-0.1",
        "notes": null,
        "status": "no_match"
      },
      "hubspot": {
        "checked_at": null,
        "matches": [],
        "method_version": null,
        "notes": "HubSpot is not connected.",
        "status": "unavailable"
      },
      "provided_exclusion_file": {
        "checked_at": null,
        "matches": [],
        "method_version": null,
        "notes": "No exclusion file supplied for this synthetic test.",
        "status": "unavailable"
      },
      "twenty": {
        "checked_at": null,
        "matches": [],
        "method_version": null,
        "notes": "Twenty is not connected.",
        "status": "unavailable"
      }
    },
    "identity": {
      "aliases": [],
      "display_name": "Bluegrass Hoof Care — Synthetic Test Record",
      "organisation": {
        "domain": "example.com",
        "name": "Bluegrass Hoof Care — Synthetic",
        "website": "https://example.com/bluegrass-hoof-care"
      },
      "person": {
        "first_name": "Jordan",
        "full_name": "Jordan Example",
        "last_name": "Example",
        "role_title": "Professional Farrier"
      }
    },
    "location": {
      "city": "Lexington",
      "country_code": "US",
      "geography_rule_version": "pilot-lexington-0.1",
      "geography_status": "in_scope",
      "postal_code": null,
      "public_address": null,
      "state_region": "Kentucky"
    },
    "prospect_type": "farrier_business",
    "provenance": {
      "audit_correlation_id": "AUDIT-TEST-0001",
      "created_by_profile": "equinet-a1-icp-discovery",
      "initiated_by": "unitalk-contract-test",
      "model": null,
      "synthetic": true,
      "tools_used": [
        "synthetic-fixture-generator"
      ]
    },
    "public_contacts": [],
    "qualification": {
      "criteria": [
        {
          "category": "fit",
          "criterion_id": "farrier.professional_activity",
          "criterion_label": "Active professional Farrier",
          "evidence_ids": [
            "EV-TEST001"
          ],
          "notes": "Supported by the synthetic business-site fixture.",
          "status": "confirmed"
        },
        {
          "category": "priority",
          "criterion_id": "farrier.sport_horse_focus",
          "criterion_label": "Works with sport or competition horses",
          "evidence_ids": [
            "EV-TEST001"
          ],
          "notes": null,
          "status": "confirmed"
        }
      ],
      "exclusion_reasons": [],
      "exclusion_status": "eligible",
      "icp_config_version": "proposed-0.1",
      "minimum_data_status": "pass",
      "missing_minimum_fields": []
    },
    "recommendation": {
      "next_action": "pass_to_a2",
      "notes": "Synthetic candidate approved for A2 handoff contract testing.",
      "priority_rank": 1,
      "suggested_owner": null,
      "suggested_territory": "Kentucky"
    },
    "record_kind": "synthetic_test",
    "run_id": "RUN-TEST-0001",
    "schema_version": "1.0.0",
    "scoring": {
      "band": "high",
      "block_reason": null,
      "components": [
        {
          "criterion_id": "farrier.professional_activity",
          "evidence_ids": [
            "EV-TEST001"
          ],
          "max_points": 50,
          "notes": "Synthetic test contribution.",
          "points_awarded": 50
        },
        {
          "criterion_id": "farrier.sport_horse_focus",
          "evidence_ids": [
            "EV-TEST001"
          ],
          "max_points": 30,
          "notes": "Synthetic test contribution.",
          "points_awarded": 22
        }
      ],
      "model_version": "synthetic-test-score-0.1",
      "rationale": "Synthetic score based on professional activity, Lexington location and sport-horse focus.",
      "score": 72,
      "status": "scored"
    },
    "segment": "farrier",
    "source_evidence": [
      {
        "access_method": "manual_browser",
        "evidence_excerpt": "Synthetic fixture: professional farrier service in Lexington supporting sport-horse clients.",
        "evidence_id": "EV-TEST001",
        "fact_or_inference": "direct_fact",
        "reliability_level": "high",
        "retrieved_at": "2026-08-11T10:00:00Z",
        "source_name": "Synthetic business website fixture",
        "source_policy_status": "approved",
        "source_type": "business_website",
        "source_url": "https://example.com/bluegrass-hoof-care",
        "supports_claims": [
          "farrier.professional_activity",
          "farrier.sport_horse_focus"
        ],
        "title": "Synthetic Professional Farrier Service"
      }
    ],
    "system_references": {
      "a2_handoff_id": "A1A2-TEST_FARRIER_001",
      "hubspot_company_id": null,
      "hubspot_contact_id": null,
      "hubspot_sync_id": null,
      "twenty_candidate_id": null
    },
    "updated_at": "2026-08-16T15:30:00Z",
    "workflow": {
      "decision_at": "2026-08-16T15:30:00Z",
      "rejection_reason": null,
      "review_decision": "approved",
      "reviewer": {
        "actor_id": "UNITALK-A1-REVIEWER-TEST",
        "actor_role": "A1 Business Reviewer",
        "display_name": "Synthetic A1 Reviewer"
      },
      "stage": "approved_for_a2"
    }
  },
  "constraints": {
    "a1_score_mutation_authorized": false,
    "crm_write_authorized": false,
    "downstream_delivery_authorized": false,
    "external_action_approval_reference": null,
    "human_review_required": true,
    "outreach_authorized": false,
    "paid_provider_authorized": false,
    "public_information_creates_consent": false
  },
  "created_at": "2026-08-16T15:30:10Z",
  "delivery": {
    "attempt_count": 1,
    "external_event_reference": "synthetic://a1-a2/TEST_FARRIER_001",
    "failure_reason": null,
    "last_attempt_at": "2026-08-16T15:30:20Z"
  },
  "delivery_state": "accepted_by_a2",
  "eligibility": {
    "evaluated_at": "2026-08-16T15:30:10Z",
    "gates": [
      {
        "gate_id": "candidate_schema",
        "reason": "Pinned A1 schema and cross-field validation passed.",
        "source_path": "candidate_snapshot",
        "status": "pass"
      },
      {
        "gate_id": "human_approval",
        "reason": "A1 human approval is recorded and consistent.",
        "source_path": "candidate_snapshot.workflow",
        "status": "pass"
      },
      {
        "gate_id": "recommendation",
        "reason": "A1 recommends pass_to_a2.",
        "source_path": "candidate_snapshot.recommendation.next_action",
        "status": "pass"
      },
      {
        "gate_id": "exclusion",
        "reason": "Candidate is eligible and not excluded.",
        "source_path": "candidate_snapshot.qualification.exclusion_status",
        "status": "pass"
      },
      {
        "gate_id": "minimum_data",
        "reason": "A1 minimum data status passed.",
        "source_path": "candidate_snapshot.qualification.minimum_data_status",
        "status": "pass"
      },
      {
        "gate_id": "identity_quality",
        "reason": "A1 data quality is validated.",
        "source_path": "candidate_snapshot.data_quality.validation_status",
        "status": "pass"
      },
      {
        "gate_id": "duplicate_batch",
        "reason": "No current-batch duplicate was found.",
        "source_path": "candidate_snapshot.duplicate_check.batch",
        "status": "pass"
      },
      {
        "gate_id": "duplicate_exclusion_file",
        "reason": "No exclusion file was supplied for the synthetic fixture.",
        "source_path": "candidate_snapshot.duplicate_check.provided_exclusion_file",
        "status": "unavailable"
      },
      {
        "gate_id": "source_policy",
        "reason": "No blocked source supports the candidate.",
        "source_path": "candidate_snapshot.source_evidence",
        "status": "pass"
      },
      {
        "gate_id": "scoring_state",
        "reason": "A1 deterministic scoring completed.",
        "source_path": "candidate_snapshot.scoring.status",
        "status": "pass"
      },
      {
        "gate_id": "audit_identity",
        "reason": "A1 audit correlation ID is present.",
        "source_path": "candidate_snapshot.provenance.audit_correlation_id",
        "status": "pass"
      },
      {